{
  "schemaVersion": "0.2.0",
  "generatedAt": "2026-09-21T14:53:23Z",
  "contentHash": "sha256:2569b6d83ad584e9859771b93dfa06554669cf07ef78d499834ffd6b3c922fba",
  "generator": {
    "name": "structura",
    "version": "e3f7343-dirty"
  },
  "root": {
    "name": "multi-environment"
  },
  "nodes": [
    {
      "id": "boundary:k8s/default/default",
      "kind": "boundary",
      "layer": "context",
      "name": "default",
      "namespace": "default",
      "tech": {
        "runtime": "kubernetes"
      },
      "attrs": {
        "namespace": "default",
        "orchestrator": "kubernetes"
      },
      "sources": [
        {
          "extractor": "k8s",
          "path": "base/api.yaml",
          "line": 4
        }
      ],
      "confidence": 1
    },
    {
      "id": "boundary:k8s/dev/dev",
      "kind": "boundary",
      "layer": "context",
      "name": "dev",
      "namespace": "dev",
      "tech": {
        "runtime": "kubernetes"
      },
      "attrs": {
        "namespace": "dev",
        "orchestrator": "kubernetes"
      },
      "sources": [
        {
          "extractor": "k8s",
          "path": "overlays/dev/db.yaml",
          "line": 4
        }
      ],
      "confidence": 1
    },
    {
      "id": "boundary:k8s/prod/prod",
      "kind": "boundary",
      "layer": "context",
      "name": "prod",
      "namespace": "prod",
      "tech": {
        "runtime": "kubernetes"
      },
      "attrs": {
        "namespace": "prod",
        "orchestrator": "kubernetes"
      },
      "sources": [
        {
          "extractor": "k8s",
          "path": "overlays/prod/db.yaml",
          "line": 4
        }
      ],
      "confidence": 1
    },
    {
      "id": "boundary:k8s/staging/staging",
      "kind": "boundary",
      "layer": "context",
      "name": "staging",
      "namespace": "staging",
      "tech": {
        "runtime": "kubernetes"
      },
      "attrs": {
        "namespace": "staging",
        "orchestrator": "kubernetes"
      },
      "sources": [
        {
          "extractor": "k8s",
          "path": "overlays/staging/db.yaml",
          "line": 4
        }
      ],
      "confidence": 1
    },
    {
      "id": "datastore:k8s/dev/db",
      "kind": "datastore",
      "layer": "container",
      "name": "db",
      "namespace": "dev",
      "tech": {
        "runtime": "kubernetes",
        "framework": "postgresql"
      },
      "attrs": {
        "image": "postgres:16",
        "images": [
          "postgres:16"
        ],
        "labels": {
          "app": "db"
        },
        "workload": "StatefulSet"
      },
      "sources": [
        {
          "extractor": "k8s",
          "path": "overlays/dev/db.yaml",
          "line": 4
        }
      ],
      "confidence": 1
    },
    {
      "id": "datastore:k8s/prod/db",
      "kind": "datastore",
      "layer": "container",
      "name": "db",
      "namespace": "prod",
      "tech": {
        "runtime": "kubernetes",
        "framework": "postgresql"
      },
      "attrs": {
        "image": "postgres:16",
        "images": [
          "postgres:16"
        ],
        "labels": {
          "app": "db"
        },
        "workload": "StatefulSet"
      },
      "sources": [
        {
          "extractor": "k8s",
          "path": "overlays/prod/db.yaml",
          "line": 4
        }
      ],
      "confidence": 1
    },
    {
      "id": "datastore:k8s/staging/db",
      "kind": "datastore",
      "layer": "container",
      "name": "db",
      "namespace": "staging",
      "tech": {
        "runtime": "kubernetes",
        "framework": "postgresql"
      },
      "attrs": {
        "image": "postgres:16",
        "images": [
          "postgres:16"
        ],
        "labels": {
          "app": "db"
        },
        "workload": "StatefulSet"
      },
      "sources": [
        {
          "extractor": "k8s",
          "path": "overlays/staging/db.yaml",
          "line": 4
        }
      ],
      "confidence": 1
    },
    {
      "id": "service:k8s/default/api",
      "kind": "service",
      "layer": "container",
      "name": "api",
      "namespace": "default",
      "tech": {
        "runtime": "kubernetes"
      },
      "attrs": {
        "image": "ghcr.io/acme/api:latest",
        "images": [
          "ghcr.io/acme/api:latest"
        ],
        "labels": {
          "app": "api"
        },
        "workload": "Deployment"
      },
      "sources": [
        {
          "extractor": "k8s",
          "path": "base/api.yaml",
          "line": 4
        }
      ],
      "confidence": 1
    }
  ],
  "edges": [
    {
      "id": "e:8879a8eea343",
      "from": "boundary:k8s/default/default",
      "to": "service:k8s/default/api",
      "kind": "contains",
      "confidence": 1,
      "evidence": [
        {
          "extractor": "k8s",
          "path": "base/api.yaml",
          "line": 4,
          "rule": "k8s_namespace_member",
          "detail": "deployed into namespace \"default\""
        }
      ]
    },
    {
      "id": "e:f9318df73af7",
      "from": "boundary:k8s/dev/dev",
      "to": "datastore:k8s/dev/db",
      "kind": "contains",
      "confidence": 1,
      "evidence": [
        {
          "extractor": "k8s",
          "path": "overlays/dev/db.yaml",
          "line": 4,
          "rule": "k8s_namespace_member",
          "detail": "deployed into namespace \"dev\""
        }
      ]
    },
    {
      "id": "e:60f4f3763e11",
      "from": "boundary:k8s/prod/prod",
      "to": "datastore:k8s/prod/db",
      "kind": "contains",
      "confidence": 1,
      "evidence": [
        {
          "extractor": "k8s",
          "path": "overlays/prod/db.yaml",
          "line": 4,
          "rule": "k8s_namespace_member",
          "detail": "deployed into namespace \"prod\""
        }
      ]
    },
    {
      "id": "e:0d2f93c39b69",
      "from": "boundary:k8s/staging/staging",
      "to": "datastore:k8s/staging/db",
      "kind": "contains",
      "confidence": 1,
      "evidence": [
        {
          "extractor": "k8s",
          "path": "overlays/staging/db.yaml",
          "line": 4,
          "rule": "k8s_namespace_member",
          "detail": "deployed into namespace \"staging\""
        }
      ]
    }
  ],
  "diagnostics": [
    {
      "severity": "warn",
      "code": "ambiguous_reference",
      "path": "base/api.yaml",
      "line": 4,
      "message": "\"postgres://api@db:5432/api\" matches 3 components (db.dev, db.prod, db.staging), so no edge was drawn; qualify the reference or scope it to a namespace"
    },
    {
      "severity": "info",
      "code": "kustomize_unrendered",
      "path": "base/kustomization.yaml",
      "message": "Kustomize overlay not applied; the manifests it lists were read directly, so its patches, name prefixes, and namespace are not reflected"
    },
    {
      "severity": "info",
      "code": "kustomize_unrendered",
      "path": "overlays/dev/kustomization.yaml",
      "message": "Kustomize overlay not applied; the manifests it lists were read directly, so its patches, name prefixes, and namespace are not reflected"
    },
    {
      "severity": "info",
      "code": "k8s_patch_fragment",
      "path": "overlays/dev/replicas.yaml",
      "message": "a manifest declaring no pod template was read as a patch rather than a component; its overrides are not reflected"
    },
    {
      "severity": "info",
      "code": "kustomize_unrendered",
      "path": "overlays/prod/kustomization.yaml",
      "message": "Kustomize overlay not applied; the manifests it lists were read directly, so its patches, name prefixes, and namespace are not reflected"
    },
    {
      "severity": "info",
      "code": "k8s_patch_fragment",
      "path": "overlays/prod/replicas.yaml",
      "message": "a manifest declaring no pod template was read as a patch rather than a component; its overrides are not reflected"
    },
    {
      "severity": "info",
      "code": "kustomize_unrendered",
      "path": "overlays/staging/kustomization.yaml",
      "message": "Kustomize overlay not applied; the manifests it lists were read directly, so its patches, name prefixes, and namespace are not reflected"
    },
    {
      "severity": "info",
      "code": "k8s_patch_fragment",
      "path": "overlays/staging/replicas.yaml",
      "message": "a manifest declaring no pod template was read as a patch rather than a component; its overrides are not reflected"
    }
  ],
  "stats": {
    "filesScanned": 11,
    "filesParsed": 11,
    "nodeCount": 8,
    "edgeCount": 4,
    "connected": 0,
    "clusters": 4,
    "durationMs": 0
  }
}
