{
  "schemaVersion": "1.0.0",
  "generatedAt": "0001-01-01T00:00:00Z",
  "contentHash": "sha256:5265226be2449aee7524206ac479d99a31fb46cc99683ae8eafd43906772e777",
  "root": {
    "name": "managed-backends"
  },
  "nodes": [
    {
      "id": "container:root",
      "kind": "service",
      "layer": "container",
      "name": "storefront",
      "tech": {
        "language": "typescript",
        "framework": "nextjs"
      },
      "attrs": {
        "dependencyCount": 10,
        "directory": ".",
        "manifest": "package.json",
        "package": "storefront",
        "usesTechnology": [
          "anthropic",
          "clerk",
          "pinecone",
          "supabase",
          "upstash",
          "posthog",
          "resend",
          "stripe"
        ]
      },
      "sources": [
        {
          "extractor": "manifest",
          "path": "package.json",
          "line": 1
        }
      ],
      "confidence": 0.8
    },
    {
      "id": "context:anthropic",
      "kind": "external",
      "layer": "context",
      "name": "anthropic",
      "namespace": "vendor",
      "attrs": {
        "vendor": "anthropic"
      },
      "sources": [
        {
          "extractor": "manifest",
          "path": "package.json",
          "line": 1
        }
      ],
      "confidence": 0.4
    },
    {
      "id": "context:clerk",
      "kind": "external",
      "layer": "context",
      "name": "clerk",
      "namespace": "vendor",
      "attrs": {
        "vendor": "clerk"
      },
      "sources": [
        {
          "extractor": "manifest",
          "path": "package.json",
          "line": 1
        }
      ],
      "confidence": 0.4
    },
    {
      "id": "context:kbqjfnwtsdplmvxr.supabase.co",
      "kind": "external",
      "layer": "context",
      "name": "kbqjfnwtsdplmvxr.supabase.co",
      "namespace": "net",
      "attrs": {
        "hostname": "kbqjfnwtsdplmvxr.supabase.co"
      },
      "sources": [
        {
          "extractor": "dotenv",
          "path": ".env.production",
          "line": 1
        }
      ],
      "confidence": 0.8
    },
    {
      "id": "context:pinecone",
      "kind": "external",
      "layer": "context",
      "name": "pinecone",
      "namespace": "vendor",
      "attrs": {
        "vendor": "pinecone"
      },
      "sources": [
        {
          "extractor": "manifest",
          "path": "package.json",
          "line": 1
        }
      ],
      "confidence": 0.4
    },
    {
      "id": "context:posthog",
      "kind": "external",
      "layer": "context",
      "name": "posthog",
      "namespace": "vendor",
      "attrs": {
        "vendor": "posthog"
      },
      "sources": [
        {
          "extractor": "manifest",
          "path": "package.json",
          "line": 1
        }
      ],
      "confidence": 0.4
    },
    {
      "id": "context:resend",
      "kind": "external",
      "layer": "context",
      "name": "resend",
      "namespace": "vendor",
      "attrs": {
        "vendor": "resend"
      },
      "sources": [
        {
          "extractor": "manifest",
          "path": "package.json",
          "line": 1
        }
      ],
      "confidence": 0.4
    },
    {
      "id": "context:stripe",
      "kind": "external",
      "layer": "context",
      "name": "stripe",
      "namespace": "vendor",
      "attrs": {
        "vendor": "stripe"
      },
      "sources": [
        {
          "extractor": "manifest",
          "path": "package.json",
          "line": 1
        }
      ],
      "confidence": 0.4
    },
    {
      "id": "context:upstash",
      "kind": "external",
      "layer": "context",
      "name": "upstash",
      "namespace": "vendor",
      "attrs": {
        "vendor": "upstash"
      },
      "sources": [
        {
          "extractor": "manifest",
          "path": "package.json",
          "line": 1
        }
      ],
      "confidence": 0.4
    }
  ],
  "edges": [
    {
      "id": "e:bb13c611d886",
      "from": "container:root",
      "to": "context:anthropic",
      "kind": "calls",
      "protocol": "https",
      "confidence": 0.4,
      "evidence": [
        {
          "extractor": "manifest",
          "path": "package.json",
          "line": 1,
          "rule": "dependency_names_vendor",
          "detail": "package.json depends on \"@anthropic-ai/sdk\", which indicates anthropic (resolves to anthropic)"
        }
      ]
    },
    {
      "id": "e:84a4b5976253",
      "from": "container:root",
      "to": "context:clerk",
      "kind": "calls",
      "protocol": "https",
      "confidence": 0.4,
      "evidence": [
        {
          "extractor": "manifest",
          "path": "package.json",
          "line": 1,
          "rule": "dependency_names_vendor",
          "detail": "package.json depends on \"@clerk/nextjs\", which indicates clerk (resolves to clerk)"
        }
      ]
    },
    {
      "id": "e:4bc87e06583a",
      "from": "container:root",
      "to": "context:kbqjfnwtsdplmvxr.supabase.co",
      "kind": "calls",
      "protocol": "https",
      "confidence": 0.8,
      "evidence": [
        {
          "extractor": "dotenv",
          "path": ".env.production",
          "line": 1,
          "rule": "external_host",
          "detail": "env NEXT_PUBLIC_SUPABASE_URL=https://kbqjfnwtsdplmvxr.supabase.co (resolves to kbqjfnwtsdplmvxr.supabase.co)"
        },
        {
          "extractor": "manifest",
          "path": "package.json",
          "line": 1,
          "rule": "library_corroborates",
          "detail": "package.json depends on \"@supabase/supabase-js\", which indicates supabase"
        }
      ]
    },
    {
      "id": "e:16d3d217a2b5",
      "from": "container:root",
      "to": "context:pinecone",
      "kind": "persists_to",
      "protocol": "https",
      "confidence": 0.4,
      "evidence": [
        {
          "extractor": "manifest",
          "path": "package.json",
          "line": 1,
          "rule": "dependency_names_vendor",
          "detail": "package.json depends on \"@pinecone-database/pinecone\", which indicates pinecone (resolves to pinecone)"
        }
      ]
    },
    {
      "id": "e:85071eebbbf8",
      "from": "container:root",
      "to": "context:posthog",
      "kind": "calls",
      "protocol": "https",
      "confidence": 0.4,
      "evidence": [
        {
          "extractor": "manifest",
          "path": "package.json",
          "line": 1,
          "rule": "dependency_names_vendor",
          "detail": "package.json depends on \"posthog-js\", which indicates posthog (resolves to posthog)"
        }
      ]
    },
    {
      "id": "e:cc05a8222387",
      "from": "container:root",
      "to": "context:resend",
      "kind": "calls",
      "protocol": "https",
      "confidence": 0.4,
      "evidence": [
        {
          "extractor": "manifest",
          "path": "package.json",
          "line": 1,
          "rule": "dependency_names_vendor",
          "detail": "package.json depends on \"resend\", which indicates resend (resolves to resend)"
        }
      ]
    },
    {
      "id": "e:5d0d13625edb",
      "from": "container:root",
      "to": "context:stripe",
      "kind": "calls",
      "protocol": "https",
      "confidence": 0.4,
      "evidence": [
        {
          "extractor": "manifest",
          "path": "package.json",
          "line": 1,
          "rule": "dependency_names_vendor",
          "detail": "package.json depends on \"stripe\", which indicates stripe (resolves to stripe)"
        }
      ]
    },
    {
      "id": "e:0efb19e7a3ca",
      "from": "container:root",
      "to": "context:upstash",
      "kind": "persists_to",
      "protocol": "https",
      "confidence": 0.4,
      "evidence": [
        {
          "extractor": "manifest",
          "path": "package.json",
          "line": 1,
          "rule": "dependency_names_vendor",
          "detail": "package.json depends on \"@upstash/redis\", which indicates upstash (resolves to upstash)"
        }
      ]
    }
  ],
  "diagnostics": [],
  "stats": {
    "filesScanned": 3,
    "filesParsed": 2,
    "nodeCount": 9,
    "edgeCount": 8,
    "connected": 9,
    "clusters": 1,
    "durationMs": 0
  }
}
