{
  "schemaVersion": "1.0.0",
  "generatedAt": "0001-01-01T00:00:00Z",
  "contentHash": "sha256:bb9b252ff6c27ca9ae984980f73eefe0b4d133cfb520ff344f61a6719591b248",
  "root": {
    "name": "helm-chart"
  },
  "nodes": [
    {
      "id": "container:api",
      "kind": "service",
      "layer": "container",
      "name": "api",
      "tech": {
        "runtime": "kubernetes"
      },
      "attrs": {
        "image": "ghcr.io/acme/api:1.2.0",
        "packaging": "helm",
        "ports": [
          8080
        ],
        "replicas": 3
      },
      "sources": [
        {
          "extractor": "helm",
          "path": "charts/api/values.yaml",
          "line": 4
        }
      ],
      "confidence": 0.4
    },
    {
      "id": "container:postgresql",
      "kind": "datastore",
      "layer": "container",
      "name": "postgresql",
      "tech": {
        "runtime": "kubernetes",
        "framework": "postgresql"
      },
      "attrs": {
        "chart": "postgresql",
        "chartRepository": "https://charts.bitnami.com/bitnami",
        "chartVersion": "14.x.x",
        "packaging": "helm-subchart"
      },
      "sources": [
        {
          "extractor": "helm",
          "path": "charts/api/Chart.yaml",
          "line": 2
        }
      ],
      "confidence": 0.95
    },
    {
      "id": "container:redis",
      "kind": "datastore",
      "layer": "container",
      "name": "redis",
      "tech": {
        "runtime": "kubernetes",
        "framework": "redis"
      },
      "attrs": {
        "chart": "redis",
        "chartRepository": "https://charts.bitnami.com/bitnami",
        "chartVersion": "18.x.x",
        "packaging": "helm-subchart"
      },
      "sources": [
        {
          "extractor": "helm",
          "path": "charts/api/Chart.yaml",
          "line": 2
        }
      ],
      "confidence": 0.95
    },
    {
      "id": "context:api",
      "kind": "boundary",
      "layer": "context",
      "name": "api",
      "attrs": {
        "appVersion": "1.2.0",
        "chartVersion": "0.3.1",
        "packaging": "helm"
      },
      "sources": [
        {
          "extractor": "helm",
          "path": "charts/api/Chart.yaml",
          "line": 2
        }
      ],
      "confidence": 1
    },
    {
      "id": "context:api.acme.example.com",
      "kind": "external",
      "layer": "context",
      "name": "api.acme.example.com",
      "namespace": "net",
      "attrs": {
        "hostname": "api.acme.example.com"
      },
      "sources": [
        {
          "extractor": "helm",
          "path": "charts/api/values.yaml"
        }
      ],
      "confidence": 0.8
    }
  ],
  "edges": [
    {
      "id": "e:82d92d4afef0",
      "from": "container:api",
      "to": "container:postgresql",
      "kind": "persists_to",
      "protocol": "postgres",
      "confidence": 0.8,
      "evidence": [
        {
          "extractor": "helm",
          "path": "charts/api/values.yaml",
          "line": 13,
          "rule": "dns_exact",
          "detail": "values env.DATABASE_URL=postgres://api@api-postgresql:5432/api (resolves to postgresql)"
        }
      ]
    },
    {
      "id": "e:ea239ed51ecf",
      "from": "container:api",
      "to": "context:api.acme.example.com",
      "kind": "calls",
      "confidence": 0.8,
      "evidence": [
        {
          "extractor": "helm",
          "path": "charts/api/values.yaml",
          "rule": "external_host",
          "detail": "values ingress.hosts.0.host=api.acme.example.com (resolves to api.acme.example.com)"
        }
      ]
    },
    {
      "id": "e:47fca6079016",
      "from": "context:api",
      "to": "container:postgresql",
      "kind": "contains",
      "confidence": 1,
      "evidence": [
        {
          "extractor": "helm",
          "path": "charts/api/Chart.yaml",
          "line": 2,
          "rule": "helm_chart_dependency",
          "detail": "chart \"api\" declares a dependency on subchart \"postgresql\""
        }
      ]
    },
    {
      "id": "e:c808afed3b02",
      "from": "context:api",
      "to": "container:redis",
      "kind": "contains",
      "confidence": 1,
      "evidence": [
        {
          "extractor": "helm",
          "path": "charts/api/Chart.yaml",
          "line": 2,
          "rule": "helm_chart_dependency",
          "detail": "chart \"api\" declares a dependency on subchart \"redis\""
        }
      ]
    }
  ],
  "diagnostics": [
    {
      "severity": "warn",
      "code": "helm_unrendered",
      "path": "charts/api/templates",
      "message": "3 Helm templates not rendered; components declared only in this chart are missing from the graph"
    },
    {
      "severity": "info",
      "code": "helm_values_inferred",
      "path": "charts/api/values.yaml",
      "message": "component \"api\" was inferred from chart default values rather than rendered templates; its name and settings may differ at install time"
    },
    {
      "severity": "info",
      "code": "unresolved_reference",
      "path": "charts/api/values.yaml",
      "line": 14,
      "message": "\"api\" refers to \"api-redis-master\", which matches no component in this repository"
    }
  ],
  "stats": {
    "filesScanned": 6,
    "filesParsed": 5,
    "nodeCount": 5,
    "edgeCount": 4,
    "connected": 3,
    "clusters": 1,
    "durationMs": 0
  }
}
